Scene,Timestamp,Dialogue,Visual Prompt (Runway/Luma),Sound Effect (Foley),Status,Tool/Notes
1,0:00 - 0:15,"We’re told that if we aren’t producing, or learning, or moving... we’re failing. But what if the most productive thing you did today was absolutely nothing? I mean, really, truly nothing.","Studio Ghibli style, close-up of a small shiny green frog on a bright green hosta leaf, transparent raindrops, watercolor texture, hand-painted aesthetic --ar 16:9","Soft rhythmic pitter-patter of rain, distant muffled thunder",To Be Generated,Runway Gen-3
2,0:15 - 0:45,"In 2026, our brains are optimized for high-speed response... I remember a summer at my grandmother’s house... just the sound of the wind.","Studio Ghibli style, wide shot of traditional Japanese house against lush foggy mountainside, soft cerulean sky, watercolor texture --ar 16:9","Hollow moan of wind through mountain pass, creak of old wood",To Be Generated,Runway Gen-3
3,0:45 - 1:00,"Setup: Why it matters in 2026.","Studio Ghibli style, young girl (Elara) sitting on an engawa porch, feet dangling above damp grass, soft moss green palette --ar 16:9","Ambient nature sounds",To Be Generated,Runway Gen-3 (Character Reference)
4,1:00 - 1:45,"The noise isn't just external. It's the hum in our heads. I used to fill every gap... But Ghibli taught me about 'Ma'—the space between.","Studio Ghibli style, Elara in a messy modern digital studio, glowing blue screens, exhausted expression, watercolor shadows --ar 16:9","Digital hum building in pitch",To Be Generated,Runway Gen-3 (Character Reference)
5,1:45 - 3:00,"Ma - The Concept.","Studio Ghibli style, Elara clicking a 'Shut Down' button, room goes dark, moonlight through window, non-digital paper grain --ar 16:9","Abrupt silence",To Be Generated,Runway Gen-3 (Character Reference)
6,3:00 - 4:00,"Act 2: The Silence. I sat by a stream for an hour... watching a single leaf caught in an eddy.","Studio Ghibli style, lush forest clearing, crystal-clear stream over mossy stones, liquid silk water texture --ar 16:9","Gentle bubbling water",To Be Generated,Runway Gen-3
7,4:00 - 5:00,"The Art of Presence.","Studio Ghibli style, red maple leaf spinning in a small whirlpool, hand-painted watercolor look --ar 16:9","High-pitched chirp of a kingfisher",To Be Generated,Runway Gen-3
8,5:00 - 6:00,"Act 3: Resolution. Real creativity comes from the silence that follows the grind.","Studio Ghibli style, field of tall wildflowers swaying in golden hour breeze, volumetric sunbeams, warm amber lighting --ar 16:9","Single deep chime of distant temple bell",To Be Generated,Runway Gen-3
9,6:00 - 6:30,"Outro: Is the fear of boredom actually a fear of meeting yourself?","Studio Ghibli style, Elara looks at the horizon, peaceful expression, indigo sweater rippling in wind, soft cinematic glow --ar 16:9","Rustle of dry grass",To Be Generated,Runway Gen-3 (Character Reference)
10,Final,Outro Fade-out,"Studio Ghibli style, single small white cloud drifting slowly over watercolor paper texture background --ar 16:9","Fade to silence",To Be Generated,Manual Overlay
